TRAINING SUMMARY - TOTAL POINTS: 2000, RELU ACTIVATION - 2026-02-15 14:33:21
============================================================
Architecture             |   RND %    |   CTR %    |   EDGE %  
---------------------------------------------------------------
[]                       |     72.00% |     74.00% |     73.00%
[5, 5]                   |     91.75% |     74.25% |     82.75%
[8, 8]                   |     97.00% |     89.00% |     86.00%
[16, 16]                 |     97.00% |     95.00% |     93.75%
[32, 32]                 |     98.25% |     98.50% |     94.75%
[64, 64]                 |     97.50% |     99.25% |     94.75%
[128, 128]               |     97.75% |     99.00% |     96.00%

============================================================
TRAINING SUMMARY - TOTAL POINTS: 2000, LEAKY_RELU ACTIVATION - 2026-02-15 14:41:11
============================================================
Architecture             |   RND %    |   CTR %    |   EDGE %  
---------------------------------------------------------------
[]                       |     73.50% |     72.00% |     70.50%
[5, 5]                   |     75.50% |     74.25% |     71.75%
[8, 8]                   |     78.00% |     74.75% |     70.50%
[16, 16]                 |     89.25% |     75.25% |     74.75%
[32, 32]                 |     90.50% |     81.50% |     73.75%
[64, 64]                 |     92.50% |     83.50% |     77.00%
[128, 128]               |     93.50% |     87.25% |     75.75%

============================================================
TRAINING SUMMARY - TOTAL POINTS: 2000, LEAKY_RELU ACTIVATION - 2026-02-15 14:43:37
============================================================
Architecture             |   RND %    |   CTR %    |   EDGE %  
---------------------------------------------------------------
[]                       |     73.00% |     72.00% |     70.50%
[5, 5]                   |     76.25% |     73.00% |     71.25%
[8, 8]                   |     87.50% |     78.00% |     74.25%
[16, 16]                 |     94.25% |     85.75% |     77.50%
[32, 32]                 |     94.75% |     88.50% |     79.75%
[64, 64]                 |     96.25% |     92.25% |     82.75%
[128, 128]               |     96.50% |     94.25% |     85.25%

============================================================
TRAINING SUMMARY - TOTAL POINTS: 2000, LEAKY_RELU ACTIVATION - 2026-02-15 14:46:52
============================================================
Architecture             |   RND %    |   CTR %    |   EDGE %  
---------------------------------------------------------------
[]                       |     73.00% |     72.25% |     70.50%
[5, 5]                   |     95.25% |     93.50% |     84.00%
[8, 8]                   |     94.50% |     97.00% |     87.50%
[16, 16]                 |     96.75% |     97.00% |     94.75%
[32, 32]                 |     99.25% |     98.50% |     94.25%
[64, 64]                 |     98.75% |     98.25% |     95.00%
[128, 128]               |     99.00% |     98.00% |     95.75%

============================================================
TRAINING SUMMARY - TOTAL POINTS: 2000, RELU ACTIVATION - 2026-02-15 15:45:00
============================================================
Architecture             |   RND %    |   CTR %    |   EDGE %  
---------------------------------------------------------------
[]                       |     73.25% |     72.25% |     70.50%
[5, 5]                   |     93.00% |     82.75% |     72.00%
[8, 8]                   |     96.25% |     91.50% |     78.25%
[16, 16]                 |     96.25% |     96.50% |     89.00%
[32, 32]                 |     98.50% |     98.25% |     94.50%
[64, 64]                 |     99.25% |     98.25% |     96.75%
[128, 128]               |     99.25% |     98.50% |     95.25%

================================================================================
MONTE CARLO SUMMARY - 2026-02-15 16:05:51
Runs: 20, Base seed: 42
Config: activation=relu, optimizer=adam, lr=0.001, epochs=100, patience=5
Split: test=0.20, val=0.20 of trainval
================================================================================
RND [] | Acc=73.49±1.72 (95%CI ±0.75) | P=0.743±0.028 (95%CI ±0.012) | R=0.723±0.032 (95%CI ±0.014) | S=0.748±0.032 (95%CI ±0.014) | F1=0.732±0.019 (95%CI ±0.008) | Time=2.13±0.24s (95%CI ±0.10s)
RND [5, 5] | Acc=89.16±5.59 (95%CI ±2.45) | P=0.895±0.053 (95%CI ±0.023) | R=0.894±0.090 (95%CI ±0.039) | S=0.890±0.074 (95%CI ±0.032) | F1=0.891±0.059 (95%CI ±0.026) | Time=3.38±0.11s (95%CI ±0.05s)
RND [8, 8] | Acc=93.46±3.78 (95%CI ±1.65) | P=0.928±0.061 (95%CI ±0.027) | R=0.949±0.028 (95%CI ±0.012) | S=0.920±0.084 (95%CI ±0.037) | F1=0.937±0.032 (95%CI ±0.014) | Time=3.30±0.34s (95%CI ±0.15s)
RND [16, 16] | Acc=97.39±1.38 (95%CI ±0.60) | P=0.978±0.013 (95%CI ±0.006) | R=0.970±0.019 (95%CI ±0.008) | S=0.978±0.014 (95%CI ±0.006) | F1=0.974±0.014 (95%CI ±0.006) | Time=3.31±0.28s (95%CI ±0.12s)
RND [32, 32] | Acc=98.25±0.62 (95%CI ±0.27) | P=0.986±0.012 (95%CI ±0.005) | R=0.980±0.009 (95%CI ±0.004) | S=0.985±0.012 (95%CI ±0.005) | F1=0.983±0.006 (95%CI ±0.003) | Time=2.76±0.65s (95%CI ±0.29s)
RND [64, 64] | Acc=98.58±0.64 (95%CI ±0.28) | P=0.989±0.011 (95%CI ±0.005) | R=0.983±0.010 (95%CI ±0.005) | S=0.989±0.011 (95%CI ±0.005) | F1=0.986±0.007 (95%CI ±0.003) | Time=2.05±0.52s (95%CI ±0.23s)
RND [128, 128] | Acc=98.43±0.62 (95%CI ±0.27) | P=0.987±0.013 (95%CI ±0.006) | R=0.982±0.009 (95%CI ±0.004) | S=0.986±0.013 (95%CI ±0.006) | F1=0.984±0.006 (95%CI ±0.003) | Time=1.71±0.45s (95%CI ±0.20s)
CTR [] | Acc=75.36±1.90 (95%CI ±0.83) | P=0.748±0.029 (95%CI ±0.013) | R=0.761±0.022 (95%CI ±0.010) | S=0.747±0.031 (95%CI ±0.014) | F1=0.754±0.019 (95%CI ±0.008) | Time=2.22±0.09s (95%CI ±0.04s)
CTR [5, 5] | Acc=84.42±5.62 (95%CI ±2.46) | P=0.845±0.065 (95%CI ±0.028) | R=0.845±0.058 (95%CI ±0.025) | S=0.843±0.074 (95%CI ±0.033) | F1=0.844±0.054 (95%CI ±0.024) | Time=3.22±0.48s (95%CI ±0.21s)
CTR [8, 8] | Acc=91.46±4.43 (95%CI ±1.94) | P=0.906±0.054 (95%CI ±0.024) | R=0.924±0.043 (95%CI ±0.019) | S=0.906±0.057 (95%CI ±0.025) | F1=0.915±0.045 (95%CI ±0.020) | Time=3.36±0.21s (95%CI ±0.09s)
CTR [16, 16] | Acc=96.51±1.34 (95%CI ±0.59) | P=0.964±0.015 (95%CI ±0.006) | R=0.967±0.020 (95%CI ±0.009) | S=0.964±0.015 (95%CI ±0.007) | F1=0.965±0.013 (95%CI ±0.006) | Time=3.44±0.11s (95%CI ±0.05s)
CTR [32, 32] | Acc=98.14±0.69 (95%CI ±0.30) | P=0.981±0.011 (95%CI ±0.005) | R=0.982±0.012 (95%CI ±0.005) | S=0.981±0.011 (95%CI ±0.005) | F1=0.981±0.007 (95%CI ±0.003) | Time=3.18±0.52s (95%CI ±0.23s)
CTR [64, 64] | Acc=98.29±0.59 (95%CI ±0.26) | P=0.982±0.009 (95%CI ±0.004) | R=0.983±0.009 (95%CI ±0.004) | S=0.982±0.009 (95%CI ±0.004) | F1=0.983±0.006 (95%CI ±0.003) | Time=2.35±0.43s (95%CI ±0.19s)
CTR [128, 128] | Acc=98.21±0.65 (95%CI ±0.28) | P=0.981±0.012 (95%CI ±0.005) | R=0.984±0.009 (95%CI ±0.004) | S=0.980±0.012 (95%CI ±0.005) | F1=0.982±0.006 (95%CI ±0.003) | Time=1.71±0.38s (95%CI ±0.17s)
EDGE [] | Acc=70.25±2.24 (95%CI ±0.98) | P=0.706±0.031 (95%CI ±0.013) | R=0.694±0.033 (95%CI ±0.015) | S=0.711±0.032 (95%CI ±0.014) | F1=0.699±0.026 (95%CI ±0.011) | Time=1.77±0.58s (95%CI ±0.25s)
EDGE [5, 5] | Acc=77.75±2.45 (95%CI ±1.07) | P=0.759±0.047 (95%CI ±0.021) | R=0.821±0.072 (95%CI ±0.032) | S=0.733±0.081 (95%CI ±0.035) | F1=0.786±0.028 (95%CI ±0.012) | Time=3.37±0.13s (95%CI ±0.05s)
EDGE [8, 8] | Acc=81.17±4.90 (95%CI ±2.15) | P=0.806±0.064 (95%CI ±0.028) | R=0.825±0.061 (95%CI ±0.027) | S=0.799±0.069 (95%CI ±0.030) | F1=0.814±0.051 (95%CI ±0.022) | Time=3.37±0.10s (95%CI ±0.04s)
EDGE [16, 16] | Acc=90.04±3.15 (95%CI ±1.38) | P=0.894±0.046 (95%CI ±0.020) | R=0.912±0.040 (95%CI ±0.017) | S=0.889±0.056 (95%CI ±0.024) | F1=0.902±0.030 (95%CI ±0.013) | Time=3.35±0.15s (95%CI ±0.07s)
EDGE [32, 32] | Acc=93.04±1.81 (95%CI ±0.79) | P=0.923±0.024 (95%CI ±0.010) | R=0.939±0.028 (95%CI ±0.012) | S=0.922±0.024 (95%CI ±0.011) | F1=0.931±0.018 (95%CI ±0.008) | Time=3.35±0.27s (95%CI ±0.12s)
EDGE [64, 64] | Acc=94.51±1.93 (95%CI ±0.84) | P=0.943±0.026 (95%CI ±0.011) | R=0.948±0.025 (95%CI ±0.011) | S=0.942±0.027 (95%CI ±0.012) | F1=0.945±0.019 (95%CI ±0.008) | Time=2.72±0.70s (95%CI ±0.31s)
EDGE [128, 128] | Acc=95.56±1.76 (95%CI ±0.77) | P=0.948±0.023 (95%CI ±0.010) | R=0.964±0.025 (95%CI ±0.011) | S=0.947±0.024 (95%CI ±0.011) | F1=0.956±0.018 (95%CI ±0.008) | Time=2.18±0.43s (95%CI ±0.19s)

============================================================
TRAINING SUMMARY - TOTAL POINTS: 2000, LEAKY_RELU ACTIVATION - 2026-02-19 09:55:28
============================================================
Architecture             |   RND %    |   CTR %    |   EDGE %  
---------------------------------------------------------------
[64, 64, 64]             |     97.50% |     97.25% |     96.25%
K=100, mode=augmented_unit_sphere |     89.50% |     93.00% |     85.00%
K=150, mode=augmented_unit_sphere |     88.75% |     92.50% |     87.00%

============================================================
TRAINING SUMMARY - TOTAL POINTS: 2000, LEAKY_RELU ACTIVATION - 2026-02-19 10:12:03
============================================================
Architecture             |   RND %    |   CTR %    |   EDGE %  
---------------------------------------------------------------
[64, 64]                 |     98.75% |     98.25% |     98.00%
K=100, mode=augmented_unit_sphere |     87.00% |     92.50% |     81.50%
K=150, mode=augmented_unit_sphere |     88.50% |     91.75% |     86.75%

============================================================
TRAINING SUMMARY - 2026-02-19 10:12:21
============================================================

ACCURACY TABLE
Architecture             |   RND %    |   CTR %    |   EDGE %  
---------------------------------------------------------------
[64, 64]                 |     98.75% |     98.25% |     98.00%
K=100, mode=augmented_unit_sphere |     87.00% |     92.50% |     81.50%
K=150, mode=augmented_unit_sphere |     88.50% |     91.75% |     86.75%

CPU TIME TABLE
Model (arch)                       |   RND s    |   CTR s    |   EDGE s   |   avg s   
--------------------------------------------------------------------------------------
MLP_0 [64, 64]                     |      1.76 |      1.84 |      2.19 |      1.93
CPN_4 K=100, mode=augmented_uni... |      1.07 |      1.06 |      1.00 |      1.04
CPN_5 K=150, mode=augmented_uni... |      1.12 |      1.15 |      1.07 |      1.11

PARAMETER COUNT TABLE
Architecture             |     # Params
---------------------------------------
[64, 64]                 |        4,417
K=100, mode=augmented_unit_sphere |          400
K=150, mode=augmented_unit_sphere |          600

P/R/S/F1 TABLE
Architecture             |       RND P/R/S/F1       |       CTR P/R/S/F1       |      EDGE P/R/S/F1      
---------------------------------------------------------------------------------------------------------
[64, 64]                 | 0.990/0.985/0.990/0.988  | 0.990/0.975/0.990/0.983  | 0.976/0.986/0.974/0.981 
K=100, mode=augmented_unit_sphere | 0.826/0.947/0.789/0.882  | 0.922/0.931/0.919/0.926  | 0.790/0.874/0.751/0.830 
K=150, mode=augmented_unit_sphere | 0.848/0.947/0.820/0.894  | 0.912/0.926/0.909/0.919  | 0.844/0.913/0.819/0.877 
