[16, 16]                 |     98.25% |     96.00% |     93.75%
[8, 8, 8, 8]             |     96.00% |     96.25% |     85.50%
[8, 8, 8, 8, 8]          |     97.25% |     98.25% |     89.75%

============================================================
TRAINING SUMMARY - TOTAL POINTS: 2000, LEAKY_RELU ACTIVATION - 2026-02-13 09:47:59
============================================================
Architecture             |   RND %    |   CTR %    |   EDGE %  
---------------------------------------------------------------
[16, 16]                 |     98.25% |     96.75% |     93.00%
[8, 8, 8, 8]             |     98.25% |     96.50% |     92.00%
[8, 8, 8, 8, 8]          |     98.25% |     87.25% |     92.75%

============================================================
TRAINING SUMMARY - TOTAL POINTS: 2000, LEAKY_RELU ACTIVATION - 2026-02-13 10:01:25
============================================================
Architecture             |   RND %    |   CTR %    |   EDGE %  
---------------------------------------------------------------
[16, 16]                 |     96.50% |     98.25% |     90.50%
[8, 8, 8, 8]             |     95.25% |     98.00% |     91.75%
[8, 8, 8, 8, 8]          |     95.75% |     94.00% |     91.75%

============================================================
TRAINING SUMMARY - TOTAL POINTS: 2000, LEAKY_RELU ACTIVATION - 2026-02-13 10:24:15
============================================================
Architecture             |   RND %    |   CTR %    |   EDGE %  
---------------------------------------------------------------
[16, 16]                 |     98.25% |     97.00% |     89.50%
[8, 8, 8, 8]             |     98.25% |     98.50% |     91.50%
[8, 8, 8, 8, 8]          |     98.00% |     95.75% |     85.75%

============================================================
TRAINING SUMMARY - TOTAL POINTS: 2000, LEAKY_RELU ACTIVATION - 2026-02-13 10:31:42
============================================================
Architecture             |   RND %    |   CTR %    |   EDGE %  
---------------------------------------------------------------
[16, 16]                 |     97.00% |     97.25% |     90.75%
[8, 8, 8, 8]             |     98.25% |     92.00% |     82.25%
[8, 8, 8, 8, 8]          |     98.25% |     97.00% |     87.75%

================================================================================
MONTE CARLO SUMMARY - 2026-02-13 10:38:08
Runs: 20, Base seed: 42
Config: activation=leaky_relu, optimizer=adam, lr=0.001, epochs=100, patience=5
Split: test=0.20, val=0.20 of trainval
================================================================================
RND [16, 16] | Acc=98.03±0.73 (95%CI ±0.32) | P=0.985±0.010 (95%CI ±0.004) | R=0.976±0.013 (95%CI ±0.006) | S=0.985±0.010 (95%CI ±0.004) | F1=0.980±0.007 (95%CI ±0.003) | Time=2.74±0.21s (95%CI ±0.09s)
RND [8, 8, 8, 8] | Acc=97.05±1.70 (95%CI ±0.74) | P=0.975±0.023 (95%CI ±0.010) | R=0.967±0.019 (95%CI ±0.008) | S=0.974±0.025 (95%CI ±0.011) | F1=0.971±0.017 (95%CI ±0.007) | Time=2.80±0.66s (95%CI ±0.29s)
CTR [16, 16] | Acc=97.16±0.86 (95%CI ±0.38) | P=0.967±0.017 (95%CI ±0.007) | R=0.977±0.008 (95%CI ±0.003) | S=0.967±0.017 (95%CI ±0.007) | F1=0.972±0.008 (95%CI ±0.004) | Time=2.72±0.14s (95%CI ±0.06s)
CTR [8, 8, 8, 8] | Acc=96.09±3.11 (95%CI ±1.36) | P=0.962±0.029 (95%CI ±0.012) | R=0.959±0.042 (95%CI ±0.018) | S=0.963±0.025 (95%CI ±0.011) | F1=0.960±0.033 (95%CI ±0.015) | Time=2.92±0.70s (95%CI ±0.31s)
EDGE [16, 16] | Acc=90.03±2.16 (95%CI ±0.95) | P=0.903±0.039 (95%CI ±0.017) | R=0.900±0.036 (95%CI ±0.016) | S=0.901±0.045 (95%CI ±0.020) | F1=0.900±0.020 (95%CI ±0.009) | Time=2.73±0.20s (95%CI ±0.09s)
EDGE [8, 8, 8, 8] | Acc=90.53±3.49 (95%CI ±1.53) | P=0.897±0.052 (95%CI ±0.023) | R=0.919±0.035 (95%CI ±0.015) | S=0.893±0.059 (95%CI ±0.026) | F1=0.907±0.033 (95%CI ±0.014) | Time=3.18±0.59s (95%CI ±0.26s)

============================================================
TRAINING SUMMARY - TOTAL POINTS: 2000, LEAKY_RELU ACTIVATION - 2026-02-13 10:43:48
============================================================
Architecture             |   RND %    |   CTR %    |   EDGE %  
---------------------------------------------------------------
[16, 16]                 |     97.25% |     97.00% |     92.25%

============================================================
TRAINING SUMMARY - TOTAL POINTS: 2000, LEAKY_RELU ACTIVATION - 2026-02-13 10:46:00
============================================================
Architecture             |   RND %    |   CTR %    |   EDGE %  
---------------------------------------------------------------
[16, 16]                 |     96.75% |     98.00% |     93.00%

============================================================
TRAINING SUMMARY - 2026-02-13 10:46:10
============================================================

ACCURACY TABLE
Architecture             |   RND %    |   CTR %    |   EDGE %  
---------------------------------------------------------------
[16, 16]                 |     96.75% |     98.00% |     93.00%

CPU TIME TABLE
Model (arch)                       |   RND s    |   CTR s    |   EDGE s   |   avg s   
--------------------------------------------------------------------------------------
MLP_2 [16, 16]                     |      2.85 |      2.84 |      2.80 |      2.83

P/R/S/F1 TABLE
Architecture             |       RND P/R/S/F1       |       CTR P/R/S/F1       |      EDGE P/R/S/F1      
---------------------------------------------------------------------------------------------------------
[16, 16]                 | 0.974/0.959/0.975/0.967  | 0.971/0.990/0.969/0.981  | 0.922/0.932/0.928/0.927 

============================================================
TRAINING SUMMARY - TOTAL POINTS: 2000, LEAKY_RELU ACTIVATION - 2026-02-13 10:47:37
============================================================
Architecture             |   RND %    |   CTR %    |   EDGE %  
---------------------------------------------------------------
[16, 16]                 |     98.25% |     96.00% |     90.00%

================================================================================
MONTE CARLO SUMMARY - 2026-02-13 10:49:13
Runs: 20, Base seed: 42
Config: activation=leaky_relu, optimizer=adam, lr=0.001, epochs=100, patience=5
Split: test=0.20, val=0.20 of trainval
================================================================================
RND [16, 16] | Acc=98.03±0.73 (95%CI ±0.32) | P=0.985±0.010 (95%CI ±0.004) | R=0.976±0.013 (95%CI ±0.006) | S=0.985±0.010 (95%CI ±0.004) | F1=0.980±0.007 (95%CI ±0.003) | Time=3.37±0.24s (95%CI ±0.11s)
