P/R/S/F1                 | 0.990/0.965/0.990/0.977 | 0.971/0.980/0.970/0.975 | 0.945/0.882/0.951/0.912 | 

============================================================
Multi-Dataset Training Results - 2026-02-10 19:18:42
============================================================
Architecture             |    RND     |    CTR     |    EDGE    | 
----------------------------------------------------------------------
[]                       |     70.00% |     85.00% |     60.00% | 
P/R/S/F1                 | 0.769/0.769/0.571/0.769 | 0.783/0.947/0.762/0.857 | 0.545/0.667/0.545/0.600 | 
[16]                     |     72.50% |     87.50% |     62.50% | 
P/R/S/F1                 | 0.895/0.654/0.857/0.756 | 0.850/0.895/0.857/0.872 | 0.571/0.667/0.591/0.615 | 
[32]                     |     77.50% |     85.00% |     62.50% | 
P/R/S/F1                 | 0.947/0.692/0.929/0.800 | 0.810/0.895/0.810/0.850 | 0.571/0.667/0.591/0.615 | 
[32, 32]                 |     90.00% |     92.50% |     62.50% | 
P/R/S/F1                 | 0.923/0.923/0.857/0.923 | 0.864/1.000/0.857/0.927 | 0.571/0.667/0.591/0.615 | 
[64]                     |     82.50% |     87.50% |     62.50% | 
P/R/S/F1                 | 0.952/0.769/0.929/0.851 | 0.850/0.895/0.857/0.872 | 0.571/0.667/0.591/0.615 | 
[64, 64]                 |     95.00% |     95.00% |     60.00% | 
P/R/S/F1                 | 0.962/0.962/0.929/0.962 | 0.947/0.947/0.952/0.947 | 0.545/0.667/0.545/0.600 | 
[64, 64, 64]             |     90.00% |     97.50% |     62.50% | 
P/R/S/F1                 | 0.923/0.923/0.857/0.923 | 0.950/1.000/0.952/0.974 | 0.571/0.667/0.591/0.615 | 

============================================================
Multi-Dataset Training Results - 2026-02-10 19:27:27
============================================================
Architecture             |    RND     |    CTR     |    EDGE    | 
----------------------------------------------------------------------
[]                       |     73.45% |     75.50% |     69.77% | 
P/R/S/F1                 | 0.732/0.730/0.739/0.731 | 0.757/0.752/0.758/0.755 | 0.718/0.685/0.711/0.701 | 
[16]                     |     98.67% |     97.70% |     92.42% | 
P/R/S/F1                 | 0.988/0.985/0.989/0.987 | 0.976/0.978/0.976/0.977 | 0.942/0.910/0.939/0.926 | 
[32]                     |     98.85% |     98.58% |     95.58% | 
P/R/S/F1                 | 0.990/0.986/0.991/0.988 | 0.985/0.987/0.985/0.986 | 0.952/0.963/0.948/0.957 | 
[32, 32]                 |     99.35% |     98.83% |     97.85% | 
P/R/S/F1                 | 0.992/0.994/0.993/0.993 | 0.990/0.986/0.990/0.988 | 0.987/0.971/0.987/0.979 | 
[64]                     |     98.88% |     98.67% |     94.62% | 
P/R/S/F1                 | 0.990/0.987/0.991/0.989 | 0.990/0.984/0.990/0.987 | 0.959/0.936/0.958/0.947 | 
[64, 64]                 |     99.28% |     99.10% |     98.62% | 
P/R/S/F1                 | 0.989/0.996/0.990/0.993 | 0.994/0.988/0.994/0.991 | 0.996/0.977/0.996/0.987 | 
[64, 64, 64]             |     98.90% |     99.10% |     97.85% | 
P/R/S/F1                 | 0.998/0.979/0.999/0.989 | 0.996/0.986/0.996/0.991 | 0.982/0.976/0.981/0.979 | 

============================================================
Multi-Dataset Training Results - 2026-02-10 20:09:11
============================================================
Architecture             |    RND     |    CTR     |    EDGE    | 
----------------------------------------------------------------------
[]                       |     25.00% |     75.00% |    100.00% | 
P/R/S/F1                 | 0.000/0.000/0.500/0.000 | 0.000/0.000/1.000/0.000 | 1.000/1.000/1.000/1.000 | 
[16]                     |     50.00% |     75.00% |     25.00% | 
P/R/S/F1                 | 0.500/0.500/0.500/0.500 | 0.000/0.000/1.000/0.000 | 0.333/0.500/0.000/0.400 | 
[32]                     |     50.00% |     75.00% |     25.00% | 
P/R/S/F1                 | 0.500/0.500/0.500/0.500 | 0.000/0.000/1.000/0.000 | 0.333/0.500/0.000/0.400 | 
[32, 32]                 |     75.00% |     75.00% |     50.00% | 
P/R/S/F1                 | 1.000/0.500/1.000/0.667 | 0.000/0.000/1.000/0.000 | 0.500/1.000/0.000/0.667 | 
[64]                     |     75.00% |     75.00% |     25.00% | 
P/R/S/F1                 | 1.000/0.500/1.000/0.667 | 0.000/0.000/1.000/0.000 | 0.333/0.500/0.000/0.400 | 
[64, 64]                 |     75.00% |     75.00% |     50.00% | 
P/R/S/F1                 | 1.000/0.500/1.000/0.667 | 0.000/0.000/1.000/0.000 | 0.500/1.000/0.000/0.667 | 
[64, 64, 64]             |     75.00% |     75.00% |     50.00% | 
P/R/S/F1                 | 1.000/0.500/1.000/0.667 | 0.000/0.000/1.000/0.000 | 0.500/1.000/0.000/0.667 | 

============================================================
Multi-Dataset Training Results - 2026-02-10 20:09:28
============================================================
Architecture             |    RND     |    CTR     |    EDGE    | 
----------------------------------------------------------------------
[]                       |     50.00% |     25.00% |     75.00% | 
P/R/S/F1                 | 0.500/0.500/0.500/0.500 | 0.250/1.000/0.000/0.400 | 0.667/1.000/0.500/0.800 | 
[16]                     |     75.00% |     75.00% |     25.00% | 
P/R/S/F1                 | 1.000/0.500/1.000/0.667 | 0.000/0.000/1.000/0.000 | 0.333/0.500/0.000/0.400 | 
[32]                     |     75.00% |     75.00% |     50.00% | 
P/R/S/F1                 | 1.000/0.500/1.000/0.667 | 0.000/0.000/1.000/0.000 | 0.500/1.000/0.000/0.667 | 
[32, 32]                 |     75.00% |     75.00% |     50.00% | 
P/R/S/F1                 | 1.000/0.500/1.000/0.667 | 0.000/0.000/1.000/0.000 | 0.500/1.000/0.000/0.667 | 
[64]                     |     75.00% |     75.00% |     50.00% | 
P/R/S/F1                 | 1.000/0.500/1.000/0.667 | 0.000/0.000/1.000/0.000 | 0.500/1.000/0.000/0.667 | 
[64, 64]                 |     75.00% |     75.00% |     50.00% | 
P/R/S/F1                 | 1.000/0.500/1.000/0.667 | 0.000/0.000/1.000/0.000 | 0.500/1.000/0.000/0.667 | 
[64, 64, 64]             |     75.00% |     75.00% |     50.00% | 
P/R/S/F1                 | 1.000/0.500/1.000/0.667 | 0.000/0.000/1.000/0.000 | 0.500/1.000/0.000/0.667 | 

============================================================
Multi-Dataset Training Results - 2026-02-10 20:09:58
============================================================
Architecture             |    RND     |    CTR     |    EDGE    | 
----------------------------------------------------------------------
[]                       |     75.00% |     75.00% |     75.00% | 
P/R/S/F1                 | 1.000/0.500/1.000/0.667 | 0.000/0.000/1.000/0.000 | 1.000/0.500/1.000/0.667 | 
[16]                     |     50.00% |     75.00% |     50.00% | 
P/R/S/F1                 | 0.500/0.500/0.500/0.500 | 0.000/0.000/1.000/0.000 | 0.500/1.000/0.000/0.667 | 
[32]                     |     75.00% |     75.00% |     25.00% | 
P/R/S/F1                 | 1.000/0.500/1.000/0.667 | 0.000/0.000/1.000/0.000 | 0.333/0.500/0.000/0.400 | 
[32, 32]                 |     75.00% |     75.00% |     50.00% | 
P/R/S/F1                 | 1.000/0.500/1.000/0.667 | 0.000/0.000/1.000/0.000 | 0.500/1.000/0.000/0.667 | 
[64]                     |     75.00% |     75.00% |     50.00% | 
P/R/S/F1                 | 1.000/0.500/1.000/0.667 | 0.000/0.000/1.000/0.000 | 0.500/1.000/0.000/0.667 | 
[64, 64]                 |     75.00% |     75.00% |     50.00% | 
P/R/S/F1                 | 1.000/0.500/1.000/0.667 | 0.000/0.000/1.000/0.000 | 0.500/1.000/0.000/0.667 | 
[64, 64, 64]             |     75.00% |     75.00% |     50.00% | 
P/R/S/F1                 | 1.000/0.500/1.000/0.667 | 0.000/0.000/1.000/0.000 | 0.500/1.000/0.000/0.667 | 

============================================================
Multi-Dataset Training Results - 2026-02-10 20:41:04
============================================================
Architecture             |    RND     |    CTR     |    EDGE    | 
----------------------------------------------------------------------
[]                       |     73.99% |     75.67% |     69.15% | 
P/R/S/F1                 | 0.737/0.741/0.738/0.739 | 0.756/0.759/0.755/0.757 | 0.692/0.695/0.688/0.694 | 
[16]                     |     99.15% |     99.13% |     97.53% | 
P/R/S/F1                 | 0.992/0.991/0.992/0.991 | 0.990/0.993/0.990/0.991 | 0.973/0.978/0.973/0.976 | 
[32]                     |     99.59% |     99.40% |     98.74% | 
P/R/S/F1                 | 0.997/0.995/0.997/0.996 | 0.993/0.995/0.993/0.994 | 0.989/0.986/0.989/0.987 | 
[32, 32]                 |     99.51% |     99.52% |     98.92% | 
P/R/S/F1                 | 0.991/0.999/0.991/0.995 | 0.993/0.997/0.993/0.995 | 0.994/0.985/0.994/0.989 | 
[64]                     |     99.67% |     99.42% |     98.99% | 
P/R/S/F1                 | 0.996/0.997/0.996/0.997 | 0.993/0.995/0.993/0.994 | 0.993/0.986/0.993/0.990 | 
[64, 64]                 |     99.66% |     99.55% |     98.86% | 
P/R/S/F1                 | 0.994/1.000/0.994/0.997 | 0.996/0.995/0.996/0.996 | 0.990/0.987/0.990/0.989 | 
[64, 64, 64]             |     99.53% |     99.32% |     98.78% | 
P/R/S/F1                 | 0.993/0.998/0.993/0.995 | 0.990/0.996/0.990/0.993 | 0.995/0.981/0.995/0.988 | 

============================================================
Multi-Dataset Training Results - 2026-02-10 20:43:35
============================================================
Architecture             |    RND     |    CTR     |    EDGE    | 
----------------------------------------------------------------------
[]                       |     75.25% |     76.75% |     67.00% | 
Train CPU ms             |   2109.38 |   6203.12 |   5875.00 | 
P/R/S/F1                 | 0.796/0.699/0.809/0.744 | 0.777/0.724/0.808/0.749 | 0.683/0.663/0.677/0.673 | 
[16]                     |     93.75% |     87.75% |     71.50% | 
Train CPU ms             |  70390.62 |  68828.12 |  69437.50 | 
P/R/S/F1                 | 0.955/0.922/0.954/0.938 | 0.895/0.844/0.909/0.869 | 0.726/0.712/0.718/0.719 | 
[32]                     |     95.50% |     88.75% |     77.25% | 
Train CPU ms             |  70062.50 |  69953.12 |  67703.12 | 
P/R/S/F1                 | 0.961/0.951/0.959/0.956 | 0.893/0.870/0.904/0.881 | 0.761/0.810/0.733/0.785 | 
[32, 32]                 |     98.75% |     96.75% |     92.75% | 
Train CPU ms             |  74859.38 |  77578.12 |  81312.50 | 
P/R/S/F1                 | 0.990/0.985/0.990/0.988 | 0.974/0.958/0.976/0.966 | 0.936/0.922/0.933/0.929 | 
[64]                     |     96.75% |     92.50% |     83.00% | 
Train CPU ms             |  69625.00 |  65875.00 |  65109.38 | 
P/R/S/F1                 | 0.975/0.961/0.974/0.968 | 0.950/0.891/0.957/0.919 | 0.816/0.863/0.795/0.839 | 
[64, 64]                 |     98.00% |     96.25% |     93.00% | 
Train CPU ms             |  32109.38 |  32937.50 |  34890.62 | 
P/R/S/F1                 | 0.976/0.985/0.974/0.981 | 0.973/0.948/0.976/0.960 | 0.912/0.956/0.903/0.933 | 
[64, 64, 64]             |     97.75% |     97.25% |     97.25% | 
Train CPU ms             |  20625.00 |  32921.88 |  29875.00 | 
P/R/S/F1                 | 0.980/0.976/0.979/0.978 | 0.989/0.953/0.990/0.971 | 0.953/0.995/0.949/0.974 | 

============================================================
Multi-Dataset Training Results - 2026-02-10 20:50:32
============================================================
Architecture             |    RND     |    CTR     |    EDGE    | 
----------------------------------------------------------------------
[]                       |     72.50% |     76.25% |     68.50% | 
Train CPU s              |      1.67 |      6.41 |      6.42 | 
P/R/S/F1                 | 0.742/0.682/0.767/0.711 | 0.751/0.792/0.732/0.771 | 0.646/0.722/0.653/0.682 | 
[16]                     |     92.00% |     88.00% |     77.00% | 
Train CPU s              |     71.39 |     70.42 |     70.81 | 
P/R/S/F1                 | 0.932/0.904/0.936/0.918 | 0.870/0.896/0.864/0.883 | 0.715/0.845/0.704/0.775 | 
[32]                     |     96.25% |     93.25% |     79.75% | 
Train CPU s              |     71.36 |     70.78 |     71.39 | 
P/R/S/F1                 | 0.984/0.939/0.985/0.961 | 0.927/0.941/0.924/0.934 | 0.752/0.845/0.756/0.796 | 
[32, 32]                 |     98.00% |     99.50% |     90.25% | 
Train CPU s              |     44.50 |     55.34 |     46.75 | 
P/R/S/F1                 | 0.985/0.975/0.985/0.980 | 1.000/0.990/1.000/0.995 | 0.863/0.941/0.869/0.900 | 
[64]                     |     97.25% |     98.00% |     86.00% | 
Train CPU s              |     72.27 |     71.47 |     71.41 | 
P/R/S/F1                 | 0.990/0.955/0.990/0.972 | 0.975/0.985/0.975/0.980 | 0.810/0.914/0.812/0.859 | 
[64, 64]                 |     98.25% |    100.00% |     93.00% | 
Train CPU s              |     37.39 |     44.98 |     49.75 | 
P/R/S/F1                 | 0.990/0.975/0.990/0.982 | 1.000/1.000/1.000/1.000 | 0.892/0.968/0.897/0.928 | 
[64, 64, 64]             |     97.50% |     99.50% |     95.50% | 
Train CPU s              |     15.67 |     16.83 |     27.70 | 
P/R/S/F1                 | 0.990/0.960/0.990/0.974 | 1.000/0.990/1.000/0.995 | 0.947/0.957/0.953/0.952 | 

============================================================
Multi-Dataset Training Results - 2026-02-10 20:52:27
============================================================
Architecture             |    RND     |    CTR     |    EDGE    | 
----------------------------------------------------------------------
[]                       |     73.00% |     74.50% |     71.00% | 
Train CPU s              |      1.58 |      6.23 |      6.36 | 
P/R/S/F1                 | 0.713/0.756/0.704/0.734 | 0.744/0.751/0.739/0.748 | 0.727/0.713/0.707/0.720 | 
[16]                     |     94.00% |     86.75% |     78.25% | 
Train CPU s              |     69.22 |     68.52 |     69.00 | 
P/R/S/F1                 | 0.935/0.944/0.936/0.939 | 0.874/0.861/0.874/0.867 | 0.768/0.837/0.723/0.801 | 
[32]                     |     92.75% |     91.75% |     80.50% | 
Train CPU s              |     68.39 |     68.52 |     68.92 | 
P/R/S/F1                 | 0.920/0.934/0.921/0.927 | 0.904/0.935/0.899/0.919 | 0.805/0.828/0.780/0.816 | 
[32, 32]                 |     98.00% |     97.50% |     88.75% | 
Train CPU s              |     48.19 |     58.34 |     45.69 | 
P/R/S/F1                 | 0.995/0.964/0.995/0.979 | 0.961/0.990/0.960/0.975 | 0.910/0.871/0.906/0.890 | 
[64]                     |     96.25% |     96.25% |     82.50% | 
Train CPU s              |     70.45 |     70.34 |     70.36 | 
P/R/S/F1                 | 0.964/0.959/0.966/0.962 | 0.956/0.970/0.955/0.963 | 0.820/0.852/0.796/0.836 | 
[64, 64]                 |     97.75% |     97.00% |     91.25% | 
Train CPU s              |     42.31 |     24.72 |     47.06 | 
P/R/S/F1                 | 0.985/0.970/0.985/0.977 | 0.952/0.990/0.950/0.971 | 0.935/0.895/0.932/0.914 | 
[64, 64, 64]             |     97.25% |     98.50% |     95.75% | 
Train CPU s              |     23.70 |     22.48 |     31.47 | 
P/R/S/F1                 | 0.979/0.964/0.980/0.972 | 0.976/0.995/0.975/0.985 | 0.949/0.971/0.942/0.960 | 

============================================================
Multi-Dataset Training Results - 2026-02-10 20:57:18
============================================================
Architecture             |    RND     |    CTR     |    EDGE    | 
----------------------------------------------------------------------
[]                       |     73.00% |     74.50% |     70.75% | 
Train CPU s              |      1.69 |      6.48 |      5.84 | 
P/R/S/F1                 | 0.713/0.756/0.704/0.734 | 0.741/0.756/0.734/0.749 | 0.723/0.713/0.702/0.718 | 
[16]                     |     93.00% |     84.50% |     79.00% | 
Train CPU s              |     71.17 |     69.69 |     69.98 | 
P/R/S/F1                 | 0.925/0.934/0.926/0.929 | 0.839/0.856/0.834/0.847 | 0.791/0.813/0.764/0.802 | 
[32]                     |     95.25% |     89.25% |     81.25% | 
Train CPU s              |     71.50 |     71.09 |     70.73 | 
P/R/S/F1                 | 0.954/0.949/0.956/0.952 | 0.895/0.891/0.894/0.893 | 0.796/0.861/0.759/0.828 | 
[32, 32]                 |     96.75% |     97.00% |     89.25% | 
Train CPU s              |     34.55 |     39.66 |     46.84 | 
P/R/S/F1                 | 0.974/0.959/0.975/0.967 | 0.957/0.985/0.955/0.971 | 0.892/0.904/0.880/0.898 | 
[64]                     |     96.50% |     95.25% |     83.00% | 
Train CPU s              |     71.56 |     70.77 |     69.62 | 
P/R/S/F1                 | 0.969/0.959/0.970/0.964 | 0.955/0.950/0.955/0.953 | 0.819/0.866/0.791/0.842 | 
[64, 64]                 |     98.25% |     98.25% |     90.75% | 
Train CPU s              |     46.80 |     41.20 |     49.38 | 
P/R/S/F1                 | 0.990/0.975/0.990/0.982 | 0.971/0.995/0.970/0.983 | 0.917/0.904/0.911/0.911 | 
[64, 64, 64]             |     97.75% |     97.25% |     92.25% | 
Train CPU s              |     25.09 |     27.73 |     43.81 | 
P/R/S/F1                 | 0.995/0.959/0.995/0.977 | 0.948/1.000/0.945/0.973 | 0.920/0.933/0.911/0.926 | 

============================================================
Multi-Dataset Training Results - 2026-02-10 21:02:27
ALL DATASETS 1000 POINTS PER CAT
============================================================
Architecture             |  RND Acc%  | RND CPU s  |  CTR Acc%  | CTR CPU s  | EDGE Acc%  | EDGE CPU s
------------------------------------------------------------------------------------------------------
[]                       |     72.75% |      1.67 |     76.50% |      6.41 |     68.50% |      6.14
Train CPU s              |      1.67 |      6.41 |      6.14 | 
P/R/S/F1                 | 0.743/0.703/0.753/0.723 | 0.744/0.804/0.726/0.773 | 0.742/0.631/0.747/0.682 | 
[16]                     |     88.75% |     69.89 |     83.50% |     68.20 |     76.00% |     68.03
Train CPU s              |     69.89 |     68.20 |     68.03 | 
P/R/S/F1                 | 0.862/0.926/0.848/0.893 | 0.806/0.879/0.791/0.841 | 0.804/0.729/0.796/0.765 | 
[32]                     |     93.75% |     70.25 |     91.75% |     69.22 |     80.75% |     70.33
Train CPU s              |     70.25 |     69.22 |     70.33 | 
P/R/S/F1                 | 0.928/0.950/0.924/0.939 | 0.892/0.950/0.886/0.920 | 0.841/0.790/0.828/0.814 | 
[32, 32]                 |     97.50% |     45.30 |     98.25% |     77.33 |     84.50% |     26.41
Train CPU s              |     45.30 |     77.33 |     26.41 | 
P/R/S/F1                 | 0.975/0.975/0.975/0.975 | 0.966/1.000/0.965/0.983 | 0.869/0.836/0.855/0.852 | 
[64]                     |     95.75% |     69.77 |     95.50% |     68.50 |     83.50% |     69.84
Train CPU s              |     69.77 |     68.50 |     69.84 | 
P/R/S/F1                 | 0.951/0.965/0.949/0.958 | 0.937/0.975/0.935/0.956 | 0.870/0.813/0.860/0.841 | 
[64, 64]                 |     97.25% |     26.53 |     96.00% |     43.02 |     90.50% |     37.06
Train CPU s              |     26.53 |     43.02 |     37.06 | 
P/R/S/F1                 | 0.975/0.970/0.975/0.973 | 0.934/0.990/0.930/0.961 | 0.923/0.897/0.914/0.910 | 
[64, 64, 64]             |     97.25% |     16.84 |     96.00% |     18.23 |     90.75% |     22.05
Train CPU s              |     16.84 |     18.23 |     22.05 | 
P/R/S/F1                 | 0.966/0.980/0.965/0.973 | 0.934/0.990/0.930/0.961 | 0.954/0.869/0.952/0.910 | 

============================================================
Multi-Dataset Training Results - 2026-02-10 21:06:00
ALL DATASETS 100 POINTS PER CAT
============================================================
Architecture             |  RND Acc%  | RND Time s |  CTR Acc%  | CTR Time s | EDGE Acc%  | EDGE Time s
-------------------------------------------------------------------------------------------------------
[]                       |     77.50% |      0.20 |     67.50% |      0.25 |     67.50% |      0.25
Train Time s             |      0.20 |      0.25 |      0.25 | 
P/R/S/F1                 | 0.842/0.727/0.833/0.780 | 0.684/0.650/0.700/0.667 | 0.682/0.714/0.632/0.698 | 
[16]                     |     72.50% |      0.33 |     80.00% |      0.33 |     67.50% |      0.32
Train Time s             |      0.33 |      0.33 |      0.32 | 
P/R/S/F1                 | 0.824/0.636/0.833/0.718 | 0.875/0.700/0.900/0.778 | 0.700/0.667/0.684/0.683 | 
[32]                     |     82.50% |      0.33 |     80.00% |      0.33 |     70.00% |      0.29
Train Time s             |      0.33 |      0.33 |      0.29 | 
P/R/S/F1                 | 0.857/0.818/0.833/0.837 | 0.875/0.700/0.900/0.778 | 0.714/0.714/0.684/0.714 | 
[32, 32]                 |     87.50% |      0.40 |     92.50% |      0.40 |     70.00% |      0.33
Train Time s             |      0.40 |      0.40 |      0.33 | 
P/R/S/F1                 | 0.905/0.864/0.889/0.884 | 0.947/0.900/0.950/0.923 | 0.714/0.714/0.684/0.714 | 
[64]                     |     72.50% |      0.33 |     85.00% |      0.33 |     65.00% |      0.16
Train Time s             |      0.33 |      0.33 |      0.16 | 
P/R/S/F1                 | 0.824/0.636/0.833/0.718 | 0.889/0.800/0.900/0.842 | 0.652/0.714/0.579/0.682 | 
[64, 64]                 |     97.50% |      0.42 |     95.00% |      0.42 |     70.00% |      0.26
Train Time s             |      0.42 |      0.42 |      0.26 | 
P/R/S/F1                 | 0.957/1.000/0.944/0.978 | 0.950/0.950/0.950/0.950 | 0.696/0.762/0.632/0.727 | 
[64, 64, 64]             |     95.00% |      0.26 |     95.00% |      0.38 |     67.50% |      0.08
Train Time s             |      0.26 |      0.38 |      0.08 | 
P/R/S/F1                 | 0.955/0.955/0.944/0.955 | 0.950/0.950/0.950/0.950 | 0.667/0.762/0.579/0.711 | 

============================================================
Multi-Dataset Training Results - 2026-02-10 21:08:20
ALL DATASETS 100 POINTS PER CAT
============================================================
Architecture             |   RND %    |   RND s    |   CTR %    |   CTR s    |   EDGE %   |   EDGE s  
------------------------------------------------------------------------------------------------------
[]                       |     22.50% |      0.20 |     87.50% |      0.25 |     72.50% |      0.25
Train Time s             |      0.20 |      0.25 |      0.25 | 
P/R/S/F1                 | 0.071/0.053/0.381/0.061 | 0.833/0.952/0.789/0.889 | 0.889/0.444/0.955/0.593 | 
[16]                     |     82.50% |      0.33 |     92.50% |      0.32 |     72.50% |      0.32
Train Time s             |      0.33 |      0.32 |      0.32 | 
P/R/S/F1                 | 0.800/0.842/0.810/0.821 | 0.950/0.905/0.947/0.927 | 0.706/0.667/0.773/0.686 | 
[32]                     |     85.00% |      0.32 |     92.50% |      0.32 |     72.50% |      0.32
Train Time s             |      0.32 |      0.32 |      0.32 | 
P/R/S/F1                 | 0.842/0.842/0.857/0.842 | 0.950/0.905/0.947/0.927 | 0.706/0.667/0.773/0.686 | 
[32, 32]                 |     97.50% |      0.40 |     95.00% |      0.39 |     72.50% |      0.40
Train Time s             |      0.40 |      0.39 |      0.40 | 
P/R/S/F1                 | 0.950/1.000/0.952/0.974 | 0.952/0.952/0.947/0.952 | 0.706/0.667/0.773/0.686 | 
[64]                     |     90.00% |      0.33 |     92.50% |      0.32 |     72.50% |      0.32
Train Time s             |      0.33 |      0.32 |      0.32 | 
P/R/S/F1                 | 0.895/0.895/0.905/0.895 | 0.950/0.905/0.947/0.927 | 0.706/0.667/0.773/0.686 | 
[64, 64]                 |    100.00% |      0.30 |     95.00% |      0.24 |     77.50% |      0.39
Train Time s             |      0.30 |      0.24 |      0.39 | 
P/R/S/F1                 | 1.000/1.000/1.000/1.000 | 0.952/0.952/0.947/0.952 | 0.800/0.667/0.864/0.727 | 
[64, 64, 64]             |    100.00% |      0.30 |     97.50% |      0.25 |     82.50% |      0.38
Train Time s             |      0.30 |      0.25 |      0.38 | 
P/R/S/F1                 | 1.000/1.000/1.000/1.000 | 1.000/0.952/1.000/0.976 | 0.789/0.833/0.818/0.811 | 

============================================================
Multi-Dataset Training Results - 2026-02-11 08:16:17
ALL DATASETS 1000 POINTS PER CAT
============================================================
Architecture             |   RND %    |   RND s    |   CTR %    |   CTR s    |   EDGE %   |   EDGE s  
------------------------------------------------------------------------------------------------------
[64]                     |     96.25% |      3.03 |     97.00% |      2.41 |     80.75% |      1.91
Train Time s             |      3.03 |      2.41 |      1.91 | 
P/R/S/F1                 | 0.958/0.963/0.962/0.961 | 0.975/0.965/0.975/0.970 | 0.818/0.822/0.791/0.820 | 
[64, 64]                 |     97.75% |      1.50 |     99.00% |      0.78 |     97.75% |      1.97
Train Time s             |      1.50 |      0.78 |      1.97 | 
P/R/S/F1                 | 0.979/0.974/0.981/0.976 | 0.995/0.985/0.995/0.990 | 0.977/0.981/0.973/0.979 | 
[64, 64, 64]             |     98.50% |      1.08 |     99.25% |      0.61 |     97.00% |      0.99
Train Time s             |      1.08 |      0.61 |      0.99 | 
P/R/S/F1                 | 0.984/0.984/0.986/0.984 | 0.995/0.990/0.995/0.992 | 0.963/0.981/0.957/0.972 | 

============================================================
Cross-Dataset Comparison - 2026-02-11 08:17:29
Models trained on: CTR
============================================================
Architecture             |    RND     |    CTR     |    EDGE    | 
----------------------------------------------------------------------
[64]                     |     90.75% |     97.00% |     74.50% | 
[64, 64]                 |     91.50% |     99.00% |     75.00% | 
[64, 64, 64]             |     90.25% |     99.25% |     74.50% | 

============================================================
Multi-Dataset Training Results - 2026-02-11 08:31:06
ALL DATASETS 1000 POINTS PER CAT
============================================================
Architecture             |   RND %    |   RND s    |   CTR %    |   CTR s    |   EDGE %   |   EDGE s  
------------------------------------------------------------------------------------------------------
[32, 32]                 |     98.00% |      1.15 |     97.25% |      1.57 |     90.25% |      1.97
Train Time s             |      1.15 |      1.57 |      1.97 | 
P/R/S/F1                 | 0.979/0.979/0.981/0.979 | 0.985/0.961/0.985/0.973 | 0.882/0.923/0.883/0.902 | 
[64]                     |     97.50% |      2.35 |     95.00% |      2.34 |     82.75% |      2.34
Train Time s             |      2.35 |      2.34 |      2.34 | 
P/R/S/F1                 | 0.978/0.968/0.981/0.973 | 0.970/0.932/0.969/0.950 | 0.802/0.856/0.801/0.828 | 
[64, 64]                 |     98.75% |      1.05 |     97.75% |      1.46 |     93.25% |      1.62
Train Time s             |      1.05 |      1.46 |      1.62 | 
P/R/S/F1                 | 0.984/0.989/0.986/0.987 | 0.995/0.961/0.995/0.978 | 0.900/0.969/0.898/0.933 | 
[64, 64, 64]             |     98.50% |      0.57 |     98.00% |      0.71 |     92.25% |      0.83
Train Time s             |      0.57 |      0.71 |      0.83 | 
P/R/S/F1                 | 0.974/0.995/0.977/0.984 | 0.985/0.976/0.985/0.980 | 0.890/0.959/0.888/0.923 | 

============================================================
Training Time Summary - 2026-02-11 08:31:13
POINTS PER CAT: 1000
============================================================
Model (arch)                       |   RND s    |   CTR s    |   EDGE s   |   avg s   
--------------------------------------------------------------------------------------
MLP_3 [32, 32]                     |      1.15 |      1.57 |      1.97 |      1.57
MLP_4 [64]                         |      2.35 |      2.34 |      2.34 |      2.34
MLP_5 [64, 64]                     |      1.05 |      1.46 |      1.62 |      1.38
MLP_6 [64, 64, 64]                 |      0.57 |      0.71 |      0.83 |      0.70

============================================================
Multi-Dataset Training Results - 2026-02-11 08:36:09
ALL DATASETS 1000 POINTS PER CAT
============================================================
Architecture             |   RND %    |   RND s    |   CTR %    |   CTR s    |   EDGE %   |   EDGE s  
------------------------------------------------------------------------------------------------------
[64]                     |     98.00% |      3.03 |     95.50% |      3.02 |     85.75% |      3.00
Train Time s             |      3.03 |      3.02 |      3.00 | 
P/R/S/F1                 | 0.964/0.995/0.967/0.979 | 0.941/0.970/0.941/0.955 | 0.867/0.854/0.861/0.861 | 
[64, 64]                 |    100.00% |      1.44 |     98.75% |      1.27 |     91.50% |      1.46
Train Time s             |      1.44 |      1.27 |      1.46 | 
P/R/S/F1                 | 1.000/1.000/1.000/1.000 | 0.980/0.995/0.980/0.987 | 0.957/0.874/0.959/0.914 | 
[64, 64, 64]             |     99.25% |      1.03 |     97.25% |      0.60 |     93.75% |      1.16
Train Time s             |      1.03 |      0.60 |      1.16 | 
P/R/S/F1                 | 0.984/1.000/0.986/0.992 | 0.965/0.980/0.966/0.972 | 0.955/0.922/0.954/0.938 | 

============================================================
Multi-Dataset Training Results - 2026-02-11 08:37:21
ALL DATASETS 1000 POINTS PER CAT
============================================================
Architecture             |   RND %    |   RND s    |   CTR %    |   CTR s    |   EDGE %   |   EDGE s  
------------------------------------------------------------------------------------------------------
[64, 64, 64]             |     95.75% |      0.47 |     96.00% |      0.42 |     66.25% |      0.24
Train Time s             |      0.47 |      0.42 |      0.24 | 
P/R/S/F1                 | 0.929/0.984/0.934/0.956 | 0.974/0.944/0.975/0.959 | 0.851/0.417/0.923/0.560 | 

============================================================
Training Time Summary - 2026-02-11 08:37:55
POINTS PER CAT: 1000
============================================================
Model (arch)                       |   RND s    |   CTR s    |   EDGE s   |   avg s   
--------------------------------------------------------------------------------------
MLP_4 [64]                         |      3.03 |      3.02 |      3.00 |      3.02
MLP_5 [64, 64]                     |      1.44 |      1.27 |      1.46 |      1.39
MLP_6 [64, 64, 64]                 |      0.47 |      0.42 |      0.24 |      0.38
