---------------------------------------------------------------
[64, 64]                 |     98.50% |     99.00% |     95.75%

============================================================
TRAINING SUMMARY - TOTAL POINTS: 2000, LEAKY_RELU ACTIVATION - 2026-02-19 10:50:42
============================================================
Architecture             |   RND %    |   CTR %    |   EDGE %  
---------------------------------------------------------------
[64, 64]                 |     98.00% |     99.00% |     97.50%
K=100, mode=l2           |     72.75% |     77.75% |     71.25%
K=150, mode=l2           |     72.50% |     77.50% |     68.75%

============================================================
TRAINING SUMMARY - 2026-02-19 10:51:12
============================================================

ACCURACY TABLE
Architecture             |   RND %    |   CTR %    |   EDGE %  
---------------------------------------------------------------
[64, 64]                 |     98.00% |     99.00% |     97.50%
K=100, mode=l2           |     72.75% |     77.75% |     71.25%
K=150, mode=l2           |     72.50% |     77.50% |     68.75%

CPU TIME TABLE
Model (arch)                       |   RND s    |   CTR s    |   EDGE s   |   avg s   
--------------------------------------------------------------------------------------
MLP_0 [64, 64]                     |      2.48 |      3.97 |      6.10 |      4.18
CPN_4 K=100, mode=l2               |      2.00 |      2.15 |      1.96 |      2.04
CPN_5 K=150, mode=l2               |      2.31 |      2.07 |      2.04 |      2.14

PARAMETER COUNT TABLE
Architecture             |     # Params
---------------------------------------
[64, 64]                 |        4,417
K=100, mode=l2           |          300
K=150, mode=l2           |          450

P/R/S/F1 TABLE
Architecture             |       RND P/R/S/F1       |       CTR P/R/S/F1       |      EDGE P/R/S/F1      
---------------------------------------------------------------------------------------------------------
[64, 64]                 | 0.980/0.980/0.980/0.980  | 0.980/1.000/0.981/0.990  | 0.966/0.985/0.964/0.976 
K=100, mode=l2           | 0.733/0.699/0.755/0.715  | 0.829/0.679/0.870/0.746  | 0.720/0.709/0.716/0.715 
K=150, mode=l2           | 0.742/0.673/0.775/0.706  | 0.772/0.756/0.792/0.764  | 0.677/0.734/0.640/0.704 

================================================================================
MONTE CARLO SUMMARY - 2026-02-19 10:56:28
Runs: 10, Base seed: 42
Config: activation=leaky_relu, optimizer=adam, lr=0.001, epochs=200, patience=10
Split: test=0.20, val=0.20 of trainval
================================================================================
RND [64, 64] | Acc=98.90±0.44 (95%CI ±0.28) | P=0.990±0.008 (95%CI ±0.005) | R=0.988±0.005 (95%CI ±0.003) | S=0.989±0.008 (95%CI ±0.005) | F1=0.989±0.004 (95%CI ±0.003) | Time=2.90±0.96s (95%CI ±0.60s)
RND K=100, mode=l2 | Acc=71.43±2.71 (95%CI ±1.68) | P=0.724±0.041 (95%CI ±0.025) | R=0.703±0.033 (95%CI ±0.020) | S=0.726±0.053 (95%CI ±0.033) | F1=0.712±0.024 (95%CI ±0.015) | Time=1.94±0.04s (95%CI ±0.02s)
RND K=150, mode=l2 | Acc=69.70±2.84 (95%CI ±1.76) | P=0.718±0.043 (95%CI ±0.027) | R=0.662±0.049 (95%CI ±0.030) | S=0.734±0.059 (95%CI ±0.037) | F1=0.687±0.029 (95%CI ±0.018) | Time=2.16±0.08s (95%CI ±0.05s)
CTR [64, 64] | Acc=98.40±0.66 (95%CI ±0.41) | P=0.987±0.009 (95%CI ±0.006) | R=0.981±0.013 (95%CI ±0.008) | S=0.987±0.009 (95%CI ±0.006) | F1=0.984±0.006 (95%CI ±0.004) | Time=2.81±0.39s (95%CI ±0.24s)
CTR K=100, mode=l2 | Acc=76.22±1.59 (95%CI ±0.99) | P=0.798±0.018 (95%CI ±0.011) | R=0.699±0.036 (95%CI ±0.022) | S=0.825±0.016 (95%CI ±0.010) | F1=0.744±0.023 (95%CI ±0.014) | Time=1.95±0.09s (95%CI ±0.05s)
CTR K=150, mode=l2 | Acc=75.73±2.36 (95%CI ±1.46) | P=0.794±0.018 (95%CI ±0.011) | R=0.691±0.045 (95%CI ±0.028) | S=0.824±0.016 (95%CI ±0.010) | F1=0.738±0.028 (95%CI ±0.017) | Time=2.08±0.07s (95%CI ±0.04s)
EDGE [64, 64] | Acc=96.92±0.84 (95%CI ±0.52) | P=0.965±0.015 (95%CI ±0.009) | R=0.974±0.022 (95%CI ±0.014) | S=0.965±0.015 (95%CI ±0.009) | F1=0.969±0.009 (95%CI ±0.006) | Time=4.31±0.82s (95%CI ±0.51s)
EDGE K=100, mode=l2 | Acc=68.73±2.55 (95%CI ±1.58) | P=0.681±0.037 (95%CI ±0.023) | R=0.695±0.046 (95%CI ±0.028) | S=0.681±0.043 (95%CI ±0.026) | F1=0.687±0.028 (95%CI ±0.018) | Time=1.96±0.08s (95%CI ±0.05s)
EDGE K=150, mode=l2 | Acc=66.90±2.06 (95%CI ±1.28) | P=0.657±0.030 (95%CI ±0.018) | R=0.693±0.045 (95%CI ±0.028) | S=0.647±0.035 (95%CI ±0.022) | F1=0.673±0.025 (95%CI ±0.016) | Time=2.04±0.06s (95%CI ±0.03s)

============================================================
TRAINING SUMMARY - TOTAL POINTS: 2000, LEAKY_RELU ACTIVATION - 2026-02-19 11:02:29
============================================================
Architecture             |   RND %    |   CTR %    |   EDGE %  
---------------------------------------------------------------
[64, 64]                 |     99.50% |     99.75% |     94.75%
K=100, mode=l2           |     71.75% |     80.00% |     72.00%
K=150, mode=l2           |     69.50% |     77.75% |     69.00%

============================================================
TRAINING SUMMARY - 2026-02-19 11:02:36
============================================================

ACCURACY TABLE
Architecture             |   RND %    |   CTR %    |   EDGE %  
---------------------------------------------------------------
[64, 64]                 |     99.50% |     99.75% |     94.75%
K=100, mode=l2           |     71.75% |     80.00% |     72.00%
K=150, mode=l2           |     69.50% |     77.75% |     69.00%

CPU TIME TABLE
Model (arch)                       |   RND s    |   CTR s    |   EDGE s   |   avg s   
--------------------------------------------------------------------------------------
MLP_0 [64, 64]                     |      1.67 |      2.07 |      2.57 |      2.10
CPN_4 K=100, mode=l2               |      1.03 |      1.06 |      1.03 |      1.04
CPN_5 K=150, mode=l2               |      1.08 |      1.12 |      1.10 |      1.10

PARAMETER COUNT TABLE
Architecture             |                   Params
---------------------------------------------------
[64, 64]                 |                    4,417
K=100, mode=l2           |              K:200 G:100
K=150, mode=l2           |              K:300 G:150

P/R/S/F1 TABLE
Architecture             |       RND P/R/S/F1       |       CTR P/R/S/F1       |      EDGE P/R/S/F1      
---------------------------------------------------------------------------------------------------------
[64, 64]                 | 1.000/0.990/1.000/0.995  | 1.000/0.995/1.000/0.998  | 0.957/0.943/0.953/0.950 
K=100, mode=l2           | 0.719/0.737/0.697/0.728  | 0.860/0.737/0.869/0.794  | 0.740/0.719/0.721/0.729 
K=150, mode=l2           | 0.688/0.741/0.646/0.714  | 0.812/0.746/0.812/0.778  | 0.687/0.752/0.621/0.718 
